{
  "id": "shanpuu_04829",
  "headword": "シャンプー",
  "reading": "しゃんぷー",
  "part_of_speech": "noun",
  "gloss": "shampoo",
  "definitions": [
    {
      "sense_number": 1,
      "gloss": "shampoo",
      "explanation": "shampoo"
    }
  ],
  "examples": [
    {
      "id": "shanpuu_04829_ex1",
      "japanese": "シャンプーで{髪|かみ}を{洗|あら}った。",
      "english": "I washed my hair with shampoo.",
      "notes": null,
      "has_audio": false,
      "sense_numbers": [
        1
      ]
    },
    {
      "id": "shanpuu_04829_ex2",
      "japanese": "このシャンプーは{香|かお}りがいい。",
      "english": "This shampoo smells good.",
      "notes": null,
      "has_audio": false,
      "sense_numbers": [
        1
      ]
    },
    {
      "id": "shanpuu_04829_ex3",
      "japanese": "ホテルのアメニティにシャンプーがついている。",
      "english": "The hotel amenities include shampoo.",
      "notes": null,
      "has_audio": false,
      "sense_numbers": [
        1
      ]
    }
  ],
  "notes": "シャンプー (from English \"shampoo\") refers to both the product and sometimes the act of washing hair.\n\nRelated terms:\n- リンス / コンディショナー (conditioner)\n- トリートメント (hair treatment)\n- ボディソープ (body wash)\n\nCommon expressions:\n- シャンプーする (to shampoo one's hair)\n- シャンプー{台|だい} (shampoo sink at hair salon)\n\nNote: At Japanese hair salons, staff may ask 「シャンプーはいかがですか」(Would you like a shampoo?) as an additional service.",
  "cross_references": [],
  "metadata": {
    "created": "2026-01-14T18:57:15Z",
    "modified": "2026-01-14T18:57:15Z",
    "ai_model": "claude-opus-4-5-20251101",
    "confidence": "high",
    "review_status": "draft",
    "jlpt_level": "N4",
    "frequency_rank": null
  }
}
