{
  "id": "yakkyoku_00097",
  "headword": "{薬局|やっきょく}",
  "reading": "やっきょく",
  "part_of_speech": "noun",
  "gloss": "pharmacy",
  "definitions": [
    {
      "sense_number": 1,
      "gloss": "pharmacy, drugstore",
      "explanation": "A store where medicines are sold and prescriptions are filled."
    }
  ],
  "examples": [
    {
      "id": "yakkyoku_00097_ex1",
      "japanese": "{薬局|やっきょく}で{薬|くすり}を{買|か}いました。",
      "english": "I bought medicine at the pharmacy.",
      "notes": null,
      "has_audio": false,
      "sense_numbers": [
        1
      ]
    },
    {
      "id": "yakkyoku_00097_ex2",
      "japanese": "この{処方箋|しょほうせん}を{薬局|やっきょく}に{持|も}っていってください。",
      "english": "Please take this prescription to the pharmacy.",
      "notes": null,
      "has_audio": false,
      "sense_numbers": [
        1
      ]
    },
    {
      "id": "yakkyoku_00097_ex3",
      "japanese": "{近|ちか}くに{薬局|やっきょく}はありますか。",
      "english": "Is there a pharmacy nearby?",
      "notes": null,
      "has_audio": false,
      "sense_numbers": [
        1
      ]
    }
  ],
  "notes": "薬局 are pharmacies that can fill prescriptions. ドラッグストア (drugstore) refers to larger stores selling over-the-counter medicines, cosmetics, and daily goods. Many pharmacies in Japan are open late and some are attached to clinics.",
  "cross_references": [],
  "metadata": {
    "created": "2026-01-07T12:20:10Z",
    "modified": "2026-01-07T12:59:26Z",
    "ai_model": "claude-opus-4-5",
    "confidence": "high",
    "review_status": "verified",
    "jlpt_level": "N5",
    "frequency_rank": null
  }
}
