{
  "id": "orooro_05542",
  "headword": "おろおろ",
  "reading": "おろおろ",
  "part_of_speech": "adverb",
  "gloss": "flustered; bewildered; at a loss",
  "definitions": [
    {
      "sense_number": 1,
      "gloss": "flustered; bewildered; at a loss",
      "explanation": "Being so confused or panicked that one doesn't know what to do."
    }
  ],
  "examples": [
    {
      "id": "orooro_05542_ex1",
      "japanese": "{火事|かじ}でおろおろしてしまった。",
      "english": "I was flustered because of the fire.",
      "notes": null,
      "has_audio": false,
      "sense_numbers": [1]
    },
    {
      "id": "orooro_05542_ex2",
      "japanese": "おろおろしていても{始|はじ}まらない。",
      "english": "Being flustered won't help anything.",
      "notes": null,
      "has_audio": false,
      "sense_numbers": [1]
    },
    {
      "id": "orooro_05542_ex3",
      "japanese": "{彼女|かのじょ}はおろおろするばかりだった。",
      "english": "She could only stand there bewildered.",
      "notes": null,
      "has_audio": false,
      "sense_numbers": [1]
    }
  ],
  "notes": "おろおろ describes a state of confusion and panic where one cannot act properly.\n\nSIMILAR WORDS:\n- あたふた: in a panic, hurriedly\n- おどおど: nervously, timidly\n- まごまご: bewildered, confused\n\nCOMMON PATTERNS:\n- おろおろする: to be flustered\n- おろおろするばかり: can only stand bewildered",
  "cross_references": [],
  "metadata": {
    "created": "2026-01-16T05:48:20Z",
    "modified": "2026-01-16T05:48:20Z",
    "ai_model": "claude-opus-4-5",
    "confidence": "high",
    "review_status": "draft",
    "jlpt_level": "N2",
    "frequency_rank": null
  }
}
