{
  "id": "shouchisuru_00547",
  "headword": "{承知|しょうち}する",
  "reading": "しょうちする",
  "part_of_speech": "noun, verb (suru)",
  "gloss": "consent, understanding",
  "definitions": [
    {
      "sense_number": 1,
      "gloss": "consent, acceptance, understanding",
      "explanation": "Agreeing to something; being aware of or understanding something."
    }
  ],
  "examples": [
    {
      "japanese": "{承知|しょうち}しました。",
      "english": "Understood. / Certainly.",
      "notes": "Formal acknowledgment"
    },
    {
      "japanese": "ご{要望|ようぼう}は{承知|しょうち}しております。",
      "english": "I understand your request.",
      "notes": "Polite business language"
    },
    {
      "japanese": "{危険|きけん}は{承知|しょうち}の{上|うえ}です。",
      "english": "I'm aware of the danger.",
      "notes": null
    }
  ],
  "notes": "{承知|しょうち} means consent or understanding.\n\nCOMMON EXPRESSIONS:\n- {承知|しょうち}しました: Understood/Certainly (polite)\n- {承知|しょうち}の{上|うえ}: knowingly, with full awareness\n- ご{承知|しょうち}の{通|とお}り: as you know\n\nPOLITENESS LEVELS:\n- わかりました: I understand (standard)\n- {承知|しょうち}しました: Understood (formal/business)\n- かしこまりました: Certainly (very formal)",
  "cross_references": [],
  "metadata": {
    "created": "2026-01-09T12:00:00Z",
    "modified": "2026-01-09T12:00:00Z",
    "ai_model": "claude-opus-4-5",
    "confidence": "high",
    "review_status": "draft",
    "jlpt_level": "N3",
    "frequency_rank": null
  }
}
