{
  "id": "mori_01117",
  "headword": "{森|もり}",
  "reading": "もり",
  "part_of_speech": "noun",
  "gloss": "forest, woods",
  "definitions": [
    {
      "sense_number": 1,
      "gloss": "forest",
      "explanation": "A large area covered with trees."
    },
    {
      "sense_number": 2,
      "gloss": "woods, grove",
      "explanation": "A smaller wooded area."
    }
  ],
  "examples": [
    {
      "japanese": "{森|もり}の{中|なか}を{歩|ある}く。",
      "english": "To walk through the forest.",
      "notes": null
    },
    {
      "japanese": "{森|もり}に{動物|どうぶつ}がいる。",
      "english": "There are animals in the forest.",
      "notes": null
    }
  ],
  "notes": "{森|もり} means forest.\n\nCOMPARE:\n- {森|もり}: forest (denser)\n- {林|はやし}: woods (less dense)\n\nCOMPOUNDS:\n- {森林|しんりん}: forest (formal)\n- {熱帯雨林|ねったいうりん}: tropical rainforest\n\nSHINTO:\n{鎮守|ちんじゅ}の{森|もり}: sacred grove around a shrine.",
  "cross_references": [],
  "metadata": {
    "created": "2026-01-09T12:00:00Z",
    "modified": "2026-01-09T12:00:00Z",
    "ai_model": "claude-opus-4-5",
    "confidence": "high",
    "review_status": "draft",
    "jlpt_level": "N3",
    "frequency_rank": null
  }
}
