{
  "id": "tora_01068",
  "headword": "{虎|とら}",
  "reading": "とら",
  "part_of_speech": "noun",
  "gloss": "tiger",
  "definitions": [
    {
      "sense_number": 1,
      "gloss": "tiger",
      "explanation": "A large striped wild cat."
    }
  ],
  "examples": [
    {
      "id": "tora_01068_ex1",
      "japanese": "{虎|とら}は{強|つよ}い{動物|どうぶつ}だ。",
      "english": "Tigers are powerful animals.",
      "notes": null,
      "has_audio": false,
      "sense_numbers": []
    },
    {
      "id": "tora_01068_ex2",
      "japanese": "{動物園|どうぶつえん}で{虎|とら}を{見|み}た。",
      "english": "I saw a tiger at the zoo.",
      "notes": null,
      "has_audio": false,
      "sense_numbers": []
    }
  ],
  "notes": "{虎|とら} refers to tigers.\n\nZODIAC:\n{寅|とら} is the third animal of the Chinese zodiac.\n\nEXPRESSIONS:\n- {虎|とら}の{威|い}を{借|か}る{狐|きつね}: a fox borrowing the tiger's power\n- {虎穴|こけつ}に{入|い}らずんば{虎子|こじ}を{得|え}ず: nothing ventured, nothing gained",
  "cross_references": [],
  "metadata": {
    "created": "2026-01-09T12:21:42Z",
    "modified": "2026-01-09T12:34:33Z",
    "ai_model": "claude-opus-4-5",
    "confidence": "high",
    "review_status": "draft",
    "jlpt_level": "N2",
    "frequency_rank": null
  }
}
