{
  "id": "kei_01916",
  "headword": "{刑|けい}",
  "reading": "けい",
  "part_of_speech": "noun",
  "gloss": "punishment, sentence, penalty",
  "definitions": [
    {
      "sense_number": 1,
      "gloss": "punishment, sentence, penalty",
      "explanation": "A legal punishment imposed for a crime."
    }
  ],
  "examples": [
    {
      "id": "kei_01916_ex1",
      "japanese": "{刑|けい}を{受|う}ける。",
      "english": "To receive a sentence.",
      "notes": null,
      "has_audio": false,
      "sense_numbers": [
        1
      ]
    },
    {
      "id": "kei_01916_ex2",
      "japanese": "{死|し}{刑|けい}",
      "english": "Death penalty.",
      "notes": null,
      "has_audio": false,
      "sense_numbers": [
        1
      ]
    },
    {
      "id": "kei_01916_ex3",
      "japanese": "{刑|けい}に{服|ふく}する。",
      "english": "To serve a sentence.",
      "notes": null,
      "has_audio": false,
      "sense_numbers": [
        1
      ]
    },
    {
      "id": "kei_01916_ex4",
      "japanese": "{裁判所|さいばんしょ}は{被告人|ひこくにん}に{懲役|ちょうえき}5{年|ねん}の{刑|けい}を{言|い}い{渡|わた}した。",
      "english": "The court sentenced the defendant to 5 years in prison.",
      "notes": null,
      "has_audio": false,
      "sense_numbers": [
        1
      ]
    }
  ],
  "notes": "{刑|けい} refers to legal punishment.\n\nTYPES OF PUNISHMENT:\n- {死|し}{刑|けい} (death penalty)\n- {懲役|ちょうえき}{刑|けい} (imprisonment)\n- {禁固|きんこ}{刑|けい} (imprisonment without labor)\n- {罰金|ばっきん}{刑|けい} (fine)\n- {実|じっ}{刑|けい} (actual prison sentence)\n- {執行|しっこう}{猶予|ゆうよ} (suspended sentence)\n\nCOMMON PATTERNS:\n- {刑|けい}を{受|う}ける (receive a sentence)\n- {刑|けい}を{言|い}い{渡|わた}す (hand down a sentence)\n- {刑|けい}に{服|ふく}する (serve a sentence)",
  "cross_references": [],
  "metadata": {
    "created": "2026-01-11T08:18:30Z",
    "modified": "2026-01-16T06:34:17Z",
    "ai_model": "claude-opus-4-5",
    "confidence": "high",
    "review_status": "draft",
    "frequency_rank": null,
    "vocabulary_tier": null
  }
}
