{
  "id": "atode_00096",
  "headword": "{後|あと}で",
  "reading": "あとで",
  "part_of_speech": "expression",
  "gloss": "after, later",
  "definitions": [
    {
      "sense_number": 1,
      "gloss": "after (doing something)",
      "explanation": "Indicates that something happens after another event."
    },
    {
      "sense_number": 2,
      "gloss": "later",
      "explanation": "At a future time, not now."
    }
  ],
  "examples": [
    {
      "japanese": "{食|た}べた{後|あと}で{散歩|さんぽ}しましょう。",
      "english": "Let's take a walk after eating.",
      "notes": "Past tense verb + 後で"
    },
    {
      "japanese": "{後|あと}で{電話|でんわ}します。",
      "english": "I'll call you later.",
      "notes": "Using 'later' meaning"
    },
    {
      "japanese": "{仕事|しごと}の{後|あと}で{飲|の}みに{行|い}きませんか。",
      "english": "Won't you go drinking after work?",
      "notes": "Noun + の後で"
    }
  ],
  "notes": "{後|あと}で is used to indicate 'after' in time. With verbs, use [verb past tense] + {後|あと}で. With nouns, use [noun] + の{後|あと}で. By itself, {後|あと}で means 'later.' The opposite is {前|まえ}に (before). Compare with {後|うしろ} which means 'behind' in location.",
  "cross_references": [],
  "metadata": {
    "created": "2026-01-07T12:00:00Z",
    "modified": "2026-01-07T12:00:00Z",
    "ai_model": "claude-opus-4-5",
    "confidence": "high",
    "review_status": "verified",
    "jlpt_level": "N5",
    "frequency_rank": null
  }
}
