{
  "id": "tsurusu_03539",
  "headword": "{吊|つ}るす",
  "reading": "つるす",
  "part_of_speech": "verb (godan)",
  "gloss": "to hang; to suspend; to dangle",
  "definitions": [
    {
      "sense_number": 1,
      "gloss": "to hang; to suspend",
      "explanation": "To attach something from above so it hangs down."
    },
    {
      "sense_number": 2,
      "gloss": "to hang up (for drying or storage)",
      "explanation": "To suspend items like clothes or food for practical purposes."
    }
  ],
  "examples": [
    {
      "id": "tsurusu_03539_ex1",
      "japanese": "{天井|てんじょう}から{照明|しょうめい}を{吊|つ}るした。",
      "english": "I hung a light from the ceiling.",
      "notes": "Sense 1: hanging from above",
      "has_audio": false,
      "sense_numbers": []
    },
    {
      "id": "tsurusu_03539_ex2",
      "japanese": "{洗濯物|せんたくもの}を{物干|ものほ}しに{吊|つ}るす。",
      "english": "I hang the laundry on the clothesline.",
      "notes": "Sense 2: hanging for drying",
      "has_audio": false,
      "sense_numbers": []
    },
    {
      "id": "tsurusu_03539_ex3",
      "japanese": "{風鈴|ふうりん}が{軒先|のきさき}に{吊|つ}るされている。",
      "english": "Wind chimes are hung under the eaves.",
      "notes": "Passive form describing a state",
      "has_audio": false,
      "sense_numbers": []
    }
  ],
  "notes": "{吊|つ}るす is a transitive verb ({他動詞|たどうし}). The intransitive pair is {吊|つ}る (to hang).\n\nASPECT ({ている}):\nThe passive form {吊|つ}るされている is commonly used to describe the state of something being hung ({絵|え}が{壁|かべ}に{吊|つ}るされている = 'a picture is hung on the wall').\n\nPARTICLE PATTERNS:\n- [object]を{吊|つ}るす (hang ~)\n- [location]から{吊|つ}るす (hang from ~)\n- [location]に{吊|つ}るす (hang on ~)\n\nCOMMON PATTERNS:\n- {天井|てんじょう}から{吊|つ}るす (hang from the ceiling)\n- {壁|かべ}に{吊|つ}るす (hang on the wall)\n- {洗濯物|せんたくもの}を{吊|つ}るす (hang laundry)\n- {干|ほ}し{柿|がき}を{吊|つ}るす (hang persimmons to dry)",
  "metadata": {
    "jlpt_level": "N2",
    "created": "2026-01-13T07:20:35Z",
    "modified": "2026-01-13T07:20:35Z",
    "review_status": "draft"
  }
}
