{
  "id": "zuihitsu_04727",
  "headword": "{随筆|ずいひつ}",
  "reading": "ずいひつ",
  "part_of_speech": "noun",
  "gloss": "essay, miscellaneous writings",
  "definitions": [
    {
      "sense_number": 1,
      "gloss": "essay, personal essay",
      "explanation": "A short piece of writing on a particular subject, often reflecting the author's personal thoughts and experiences."
    }
  ],
  "examples": [
    {
      "id": "zuihitsu_04727_ex1",
      "japanese": "{彼女|かのじょ}は{随筆|ずいひつ}{家|か}として{有名|ゆうめい}だ。",
      "english": "She is famous as an essayist.",
      "notes": "随筆家 = essayist",
      "has_audio": false,
      "sense_numbers": [
        1
      ]
    },
    {
      "id": "zuihitsu_04727_ex2",
      "japanese": "この{随筆|ずいひつ}{集|しゅう}には{日常|にちじょう}{生活|せいかつ}についての{文章|ぶんしょう}が{載|の}っている。",
      "english": "This essay collection contains writings about everyday life.",
      "notes": null,
      "has_audio": false,
      "sense_numbers": [
        1
      ]
    },
    {
      "id": "zuihitsu_04727_ex3",
      "japanese": "{枕草子|まくらのそうし}は{日本|にほん}{最古|さいこ}の{随筆|ずいひつ}と{言|い}われている。",
      "english": "The Pillow Book is said to be Japan's oldest essay collection.",
      "notes": "A famous work by Sei Shōnagon from the Heian period",
      "has_audio": false,
      "sense_numbers": [
        1
      ]
    }
  ],
  "notes": "{随筆|ずいひつ} is the Japanese term for personal essays. The genre has a long history in Japan, with classics like {枕草子|まくらのそうし} (The Pillow Book) and {徒然草|つれづれぐさ} (Essays in Idleness).\n\nThe word literally means 'writing following the brush' (随 = following, 筆 = brush/pen), suggesting the informal, flowing nature of the writing.\n\nCOMMON COMPOUNDS:\n- {随筆|ずいひつ}{家|か}: essayist\n- {随筆|ずいひつ}{集|しゅう}: essay collection\n\nCLASSIC JAPANESE ESSAYS:\n- {枕草子|まくらのそうし}: The Pillow Book (Sei Shōnagon)\n- {徒然草|つれづれぐさ}: Essays in Idleness (Yoshida Kenkō)\n- {方丈記|ほうじょうき}: An Account of My Hut (Kamo no Chōmei)\n\nSYNONYM:\n- エッセイ: essay (loanword, more commonly used in modern contexts)",
  "metadata": {
    "created": "2026-01-13T22:31:30Z",
    "modified": "2026-01-13T22:31:30Z",
    "ai_model": "claude-opus-4-5",
    "confidence": "high",
    "review_status": "draft",
    "jlpt_level": "N1",
    "frequency_rank": null
  }
}
