{
  "id": "imasara_00499",
  "headword": "{今更|いまさら}",
  "reading": "いまさら",
  "part_of_speech": "adverb",
  "gloss": "now (after all this time), at this late stage",
  "definitions": [
    {
      "sense_number": 1,
      "gloss": "now (after all this time), at this late stage",
      "explanation": "Indicates that it's too late for something, or questions the point of doing something now."
    }
  ],
  "examples": [
    {
      "japanese": "{今更|いまさら}{言|い}われても{困|こま}る。",
      "english": "It's troublesome to be told that now (of all times).",
      "notes": null
    },
    {
      "japanese": "{今更|いまさら}{後悔|こうかい}しても{遅|おそ}い。",
      "english": "It's too late to regret it now.",
      "notes": null
    },
    {
      "japanese": "{今更|いまさら}ですが、{質問|しつもん}があります。",
      "english": "I know it's late to ask, but I have a question.",
      "notes": "Polite hedging usage"
    }
  ],
  "notes": "{今更|いまさら} expresses that something is too late or pointless at this stage.\n\nCOMMON PATTERNS:\n- {今更|いまさら}～ても (even if ~ now...)\n- {今更|いまさら}ですが (I know it's late, but...)\n- {今更|いまさら}ながら (belatedly, even now)\n\nNUANCES:\n- Often implies frustration or resignation\n- Can soften requests when used with ですが\n- {今更|いまさら}ながら is more literary/formal",
  "cross_references": [],
  "metadata": {
    "created": "2026-01-09T11:57:15Z",
    "modified": "2026-01-09T11:57:15Z",
    "ai_model": "claude-opus-4-5",
    "confidence": "high",
    "review_status": "verified",
    "jlpt_level": "N2",
    "frequency_rank": null
  }
}
