{
  "id": "sakusaku_05963",
  "headword": "さくさく",
  "reading": "さくさく",
  "part_of_speech": "adverb, na-adjective",
  "gloss": "crispy; crunchy; smoothly progressing",
  "definitions": [
    {
      "sense_number": 1,
      "gloss": "crispy; crunchy",
      "explanation": "Describes a light, pleasant crunchiness, typically of food with a delicate texture like tempura, fresh vegetables, or pastries."
    },
    {
      "sense_number": 2,
      "gloss": "smoothly; efficiently; quickly",
      "explanation": "Describes something proceeding smoothly without hindrance, especially work or tasks."
    }
  ],
  "examples": [
    {
      "id": "sakusaku_05963_ex1",
      "japanese": "この{天|てん}ぷらはさくさくしておいしい。",
      "english": "This tempura is crispy and delicious.",
      "notes": null,
      "has_audio": false,
      "sense_numbers": [1]
    },
    {
      "id": "sakusaku_05963_ex2",
      "japanese": "{新鮮|しんせん}な{野菜|やさい}のさくさくした{食感|しょっかん}が{好|す}きだ。",
      "english": "I like the crispy texture of fresh vegetables.",
      "notes": null,
      "has_audio": false,
      "sense_numbers": [1]
    },
    {
      "id": "sakusaku_05963_ex3",
      "japanese": "{仕事|しごと}がさくさく{進|すす}む。",
      "english": "The work is progressing smoothly.",
      "notes": null,
      "has_audio": false,
      "sense_numbers": [2]
    }
  ],
  "notes": "さくさく is a versatile onomatopoeia with both food-related and abstract meanings.\n\nCOMMON PATTERNS:\n- さくさくした{食感|しょっかん}: crispy texture\n- さくさく{進|すす}む: to progress smoothly\n- さくさく{動|うご}く: to run smoothly (computers, devices)\n\nCONTRAST WITH OTHER CRUNCHY SOUNDS:\n- ぱりぱり: crispy (dry, like chips)\n- ばりばり: hard crunching\n- しゃきしゃき: fresh crispness (vegetables)",
  "cross_references": [],
  "metadata": {
    "created": "2026-01-16T14:51:32Z",
    "modified": "2026-01-16T14:51:32Z",
    "ai_model": "claude-opus-4-5",
    "confidence": "high",
    "review_status": "draft",
    "frequency_rank": null,
    "vocabulary_tier": null
  }
}
