{
  "id": "unga_03802",
  "headword": "{運河|うんが}",
  "reading": "うんが",
  "part_of_speech": "noun",
  "gloss": "canal; waterway",
  "definitions": [
    {
      "sense_number": 1,
      "gloss": "canal; waterway",
      "explanation": "An artificial waterway constructed for navigation, irrigation, or water supply."
    }
  ],
  "examples": [
    {
      "japanese": "パナマ{運河|うんが}は{太平洋|たいへいよう}と{大西洋|たいせいよう}を{結|むす}んでいる。",
      "english": "The Panama Canal connects the Pacific and Atlantic Oceans.",
      "notes": null
    },
    {
      "japanese": "{運河|うんが}を{船|ふね}が{通|とお}る。",
      "english": "Boats pass through the canal.",
      "notes": null
    },
    {
      "japanese": "この{運河|うんが}は{江戸|えど}{時代|じだい}に{作|つく}られた。",
      "english": "This canal was built during the Edo period.",
      "notes": null
    }
  ],
  "notes": "USAGE: Refers to artificial waterways, as opposed to natural rivers.\n\nFAMOUS CANALS:\n・パナマ{運河|うんが} (Panama Canal)\n・スエズ{運河|うんが} (Suez Canal)\n・{小樽|おたる}{運河|うんが} (Otaru Canal - famous tourist spot in Hokkaido)\n\nIN JAPAN: Many historical canals were built for transporting goods, especially during the Edo period. Some have been preserved as scenic spots.\n\nRELATED:\n・{水路|すいろ} (waterway, channel)\n・{川|かわ} (river - natural)",
  "cross_references": [],
  "metadata": {
    "created": "2026-01-13T07:50:37Z",
    "modified": "2026-01-13T07:50:37Z",
    "ai_model": "claude-opus-4-5",
    "confidence": "high",
    "review_status": "draft",
    "jlpt_level": "N2",
    "frequency_rank": null
  }
}
