{
  "id": "tanomu_00100",
  "headword": "{頼|たの}む",
  "reading": "たのむ",
  "part_of_speech": "verb (godan)",
  "gloss": "to request, to ask (a favor)",
  "definitions": [
    {
      "sense_number": 1,
      "gloss": "to request, to ask (for help/a favor)",
      "explanation": "To make a request to someone, often asking them to do something for you."
    },
    {
      "sense_number": 2,
      "gloss": "to order (food, etc.)",
      "explanation": "To request a specific item at a restaurant or store."
    },
    {
      "sense_number": 3,
      "gloss": "to rely on, to depend on",
      "explanation": "To count on someone for help or support."
    }
  ],
  "examples": [
    {
      "japanese": "{友達|ともだち}に{手伝|てつだ}いを{頼|たの}みました。",
      "english": "I asked my friend for help.",
      "notes": null,
      "has_audio": false
    },
    {
      "japanese": "ビールを{二|ふた}つ{頼|たの}んだ。",
      "english": "I ordered two beers.",
      "notes": "Ordering at a restaurant",
      "has_audio": false
    },
    {
      "japanese": "お{願|ねが}いがあるんですが、{頼|たの}んでもいいですか。",
      "english": "I have a favor to ask. May I ask you?",
      "notes": null,
      "has_audio": false
    }
  ],
  "notes": "TRANSITIVITY: {他動詞|たどうし} (transitive). No pair verb. Pattern: Xを{頼|たの}む (request X) / Xに{頼|たの}む (ask X [person]).\n\nASPECT: ている indicates ongoing/repeated state. {頼|たの}んでいる = 'have requested' or 'am relying on.'\n\nCOMMON PATTERNS:\n・{人|ひと}に{頼|たの}む (ask someone)\n・{仕事|しごと}を{頼|たの}む (request work/task)\n・ビールを{頼|たの}む (order beer)\n・{頼|たの}むよ (please!\n- casual request)\n\nRelated:\n- お{願|ねが}いします (polite request)\n- {頼|たの}み (noun - favor/request).",
  "cross_references": [],
  "metadata": {
    "created": "2026-01-07T12:44:55Z",
    "modified": "2026-01-07T12:25:14Z",
    "ai_model": "claude-opus-4-5",
    "confidence": "high",
    "review_status": "verified",
    "jlpt_level": "N5",
    "frequency_rank": null
  }
}
