{
  "id": "kirisuteru_05865",
  "headword": "{切|き}り{捨|す}てる",
  "reading": "きりすてる",
  "part_of_speech": "verb (ichidan)",
  "gloss": "to cut down, to discard",
  "definitions": [
    {
      "sense_number": 1,
      "gloss": "to cut down, to strike down",
      "explanation": "To kill by cutting with a sword."
    },
    {
      "sense_number": 2,
      "gloss": "to discard, to abandon",
      "explanation": "To ruthlessly eliminate or get rid of something."
    },
    {
      "sense_number": 3,
      "gloss": "to truncate, to round down",
      "explanation": "In mathematics, to drop digits below a certain decimal place."
    }
  ],
  "examples": [
    {
      "id": "kirisuteru_05865_ex1",
      "japanese": "{無駄|むだ}な{経費|けいひ}を{切|き}り{捨|す}てる。",
      "english": "To eliminate unnecessary expenses.",
      "notes": null,
      "has_audio": false,
      "sense_numbers": [2]
    },
    {
      "id": "kirisuteru_05865_ex2",
      "japanese": "{小数点以下|しょうすうてんいか}を{切|き}り{捨|す}てる。",
      "english": "To truncate the decimal places.",
      "notes": null,
      "has_audio": false,
      "sense_numbers": [3]
    },
    {
      "id": "kirisuteru_05865_ex3",
      "japanese": "{弱者|じゃくしゃ}を{切|き}り{捨|す}ててはいけない。",
      "english": "We mustn't abandon the weak.",
      "notes": null,
      "has_audio": false,
      "sense_numbers": [2]
    }
  ],
  "notes": "COMPOUND VERB:\nFormed from {切|き}る (to cut) + {捨|す}てる (to throw away).\n\nCONTRAST:\n- {切|き}り{上|あ}げる: to round up (opposite in math context)",
  "cross_references": [],
  "metadata": {
    "created": "2026-01-16T08:43:51Z",
    "modified": "2026-01-16T08:43:51Z",
    "ai_model": "claude-opus-4-5",
    "confidence": "high",
    "review_status": "draft",
    "frequency_rank": null,
    "vocabulary_tier": null
  }
}
