{
  "id": "resutoran_00097",
  "headword": "レストラン",
  "reading": "れすとらん",
  "part_of_speech": "noun",
  "gloss": "restaurant",
  "definitions": [
    {
      "sense_number": 1,
      "gloss": "restaurant",
      "explanation": "An establishment where meals are served to customers. From French/English 'restaurant.'"
    }
  ],
  "examples": [
    {
      "japanese": "{新|あたら}しいレストランに{行|い}きました。",
      "english": "I went to a new restaurant.",
      "notes": null
    },
    {
      "japanese": "このレストランは{予約|よやく}が{必要|ひつよう}です。",
      "english": "This restaurant requires a reservation.",
      "notes": null
    },
    {
      "japanese": "レストランで{誕生日|たんじょうび}パーティーをしました。",
      "english": "We had a birthday party at the restaurant.",
      "notes": null
    }
  ],
  "notes": "レストラン typically refers to Western-style restaurants. For Japanese restaurants, 料理屋 (りょうりや) or 食堂 (しょくどう) might be used. ファミレス (family restaurant) refers to casual chain restaurants popular with families.",
  "cross_references": [],
  "metadata": {
    "created": "2026-01-07T12:04:47Z",
    "modified": "2026-01-07T12:13:53Z",
    "ai_model": "claude-opus-4-5",
    "confidence": "high",
    "review_status": "verified",
    "jlpt_level": "N5",
    "frequency_rank": null
  }
}
