{
  "id": "gojuu_00096",
  "headword": "{五十|ごじゅう}",
  "reading": "ごじゅう",
  "part_of_speech": "number",
  "gloss": "fifty",
  "definitions": [
    {
      "sense_number": 1,
      "gloss": "fifty",
      "explanation": "The number fifty. Formed by combining {五|ご} (five) and {十|じゅう} (ten), literally meaning 'five tens.'"
    }
  ],
  "examples": [
    {
      "id": "gojuu_00096_ex1",
      "japanese": "{祖父|そふ}は{五十|ごじゅう}{年|ねん}{前|まえ}にこの{家|いえ}を{建|た}てました。",
      "english": "My grandfather built this house fifty years ago.",
      "notes": null,
      "has_audio": false,
      "sense_numbers": [1]
    },
    {
      "id": "gojuu_00096_ex2",
      "japanese": "{五十|ごじゅう}{人|にん}が{集|あつ}まりました。",
      "english": "Fifty people gathered.",
      "notes": null,
      "has_audio": false,
      "sense_numbers": [1]
    },
    {
      "id": "gojuu_00096_ex3",
      "japanese": "{五十音|ごじゅうおん}を{覚|おぼ}えましょう。",
      "english": "Let's learn the fifty sounds (Japanese syllabary).",
      "notes": null,
      "has_audio": false,
      "sense_numbers": [1]
    }
  ],
  "notes": "{五十音|ごじゅうおん} (literally 'fifty sounds') refers to the Japanese syllabary system of hiragana and katakana. Although there aren't exactly fifty sounds, this traditional name persists. The {五十音|ごじゅうおん}{順|じゅん} (fifty-sounds order) is the Japanese equivalent of alphabetical order.",
  "cross_references": [],
  "metadata": {
    "created": "2026-01-07T12:01:42Z",
    "modified": "2026-01-07T12:17:31Z",
    "ai_model": "claude-opus-4-5",
    "confidence": "high",
    "review_status": "verified",
    "jlpt_level": "N5",
    "frequency_rank": null
  }
}
