{
  "id": "zaisan_00443",
  "headword": "{財産|ざいさん}",
  "reading": "ざいさん",
  "part_of_speech": "noun",
  "gloss": "property, fortune, assets",
  "definitions": [
    {
      "sense_number": 1,
      "gloss": "property, assets, wealth",
      "explanation": "Things of value that a person or organization owns, including money, land, and possessions."
    },
    {
      "sense_number": 2,
      "gloss": "fortune, estate",
      "explanation": "A large amount of money or valuable possessions."
    }
  ],
  "examples": [
    {
      "japanese": "{彼|かれ}は{財産|ざいさん}を{全部|ぜんぶ}{失|うしな}った。",
      "english": "He lost all his property.",
      "notes": null
    },
    {
      "japanese": "{財産|ざいさん}を{子供|こども}たちに{残|のこ}したい。",
      "english": "I want to leave my fortune to my children.",
      "notes": null
    },
    {
      "japanese": "{知識|ちしき}は{一生|いっしょう}の{財産|ざいさん}です。",
      "english": "Knowledge is a lifelong asset.",
      "notes": "Figurative use"
    }
  ],
  "notes": "{財産|ざいさん} refers to property, assets, or wealth.\n\nCOMMON PATTERNS:\n- {財産|ざいさん}を{築|きず}く (build up one's fortune)\n- {財産|ざいさん}を{相続|そうぞく}する (inherit property)\n- {財産|ざいさん}を{管理|かんり}する (manage assets)\n- {知的|ちてき}{財産|ざいさん} (intellectual property)\n\nSIMILAR WORDS:\n- {資産|しさん}: assets (more formal, business term)\n- {財産|ざいさん}: property, wealth (general)\n- お{金|かね}: money\n- {富|とみ}: wealth, fortune",
  "cross_references": [],
  "metadata": {
    "created": "2026-01-09T11:41:04Z",
    "modified": "2026-01-09T11:41:04Z",
    "ai_model": "claude-opus-4-5",
    "confidence": "high",
    "review_status": "verified",
    "jlpt_level": "N3",
    "frequency_rank": null
  }
}
